datetime,reason,weight,is_member,channel_id,author_name,message,processed_msg
2022-02-10 21:04:55,slow_mode_hit,0,False,UCE5gxIAlH5azV2EQMWViYCQ,仁{じん},あの案件に滑り込むが得意のフブちゃんはどに行ったの？大口を叩いたの割に大した売り上げ上げられないからもう二度と案件貰えなくなった？,['あの案件に滑り込むが得意のフブちゃんはどに行ったの？大口を叩いたの割に大した売り上げ上げられないからもう二度と案件貰えなくなった？']
2022-02-10 21:04:55,similar_long_msg,0,False,UCZWxQ11H5GzxXsJWdycVF7A,さなきち,お前の全ては既YAGOOの手によって、白上フブキと名付けたVTuberに縛られた、その関係が切られてすべてを失うのは怖いでしょう？,['お前の全ては既YAGOOの手によって、白上フブキと名付けたVTuberに縛られた、その関係が切られてすべてを失うのは怖いでしょう？']
2022-02-10 21:04:55,id_in_block_list,0,False,UCZWxQ11H5GzxXsJWdycVF7A,さなきち,お前の全ては既に谷郷の手によって、日上フブキと名付けたVTuberに限られ、その関係が切られてすべてを失うのは怖いでしょう？,['お前の全ては既に谷郷の手によって、日上フブキと名付けたVTuberに限られ、その関係が切られてすべてを失うのは怖いでしょう？']
2022-02-10 21:04:55,id_in_block_list,0,False,UCZWxQ11H5GzxXsJWdycVF7A,さなきち,枕営業無縁というスキル持ってる白上は商談との性が抜群だ、その身でホロライブを守ったのか？,['枕営業無縁というスキル持ってる白上は商談との性が抜群だ、その身でホロライブを守ったのか？']
2022-02-10 21:04:55,id_in_block_list,0,False,UCZWxQ11H5GzxXsJWdycVF7A,さなきち,バーチャルの皮を被って、偽物のスウジを揃っても、現実かられられないよ,['バーチャルの皮を被って、偽物のスウジを揃っても、現実かられられないよ']
2022-02-10 21:04:55,id_in_block_list,0,False,UCZWxQ11H5GzxXsJWdycVF7A,さなきち,フブキングの解説わりやすくてええな,['フブキングの解説わりやすくてええな']
2022-02-10 21:04:55,id_in_block_list,0,False,UCZWxQ11H5GzxXsJWdycVF7A,さなきち,全ての案件に割り込むフブキちゃ何処に行った？大口を叩いたの割に大した売り上げ上げられないからもう二度と案件貰えなくなった？,['全ての案件に割り込むフブキちゃ何処に行った？大口を叩いたの割に大した売り上げ上げられないからもう二度と案件貰えなくなった？']
2022-02-10 21:04:55,name_2_words_msg_jp,0,False,UCA-4JYvzWq4Qqw8qw5RuF1Q,Sanford Rusk,疲れたらあずきちと落ち着いて飲むことも可能 ,['疲れたらあずきちと落ち着いて飲むことも可能']
2022-02-10 21:04:55,name_2_words_msg_jp,0,False,UCPN9ZKCtXIcSCjdKXhUGkHA,kelley mckaughan,もうこうなったらリップル暴れまくってランキング滅茶苦茶にしてくれ ,['もうこうなったらリップル暴れまくってランキング滅茶苦茶にしてくれ']
2022-02-10 21:04:56,name_2_words_msg_jp,0,False,UCLGZZh-d25zxSEag1bjo79g,carmen przybyla,触れなかったら歌みたまで出してるのになんで触れないんだっていうじゃん？ ,['触れなかったら歌みたまで出してるのになんで触れないんだっていうじゃん？']
2022-02-10 21:04:56,slow_mode_hit,0,False,UCzj8dL2sWGw6uUHGnSkWqmg,潤羽ますき™︎,えーちゃんが頑張ってるから、営業宣伝も結果出せないフブちゃんも必要なくなたね,['えーちゃんが頑張ってるから、営業宣伝も結果出せないフブちゃんも必要なくなたね']
2022-02-10 21:04:56,slow_mode_hit,0,False,UCzj8dL2sWGw6uUHGnSkWqmg,潤羽ますき™︎,その一千万はどこに行った？最近5chすらお前の先が見えないね,['その一千万はどこに行った？最近5chすらお前の先が見えないね']
2022-02-10 21:04:56,id_in_block_list,0,False,UCBVKV17eTJ4izzWrZD1OcRQ,Eddie Wildes,ある住民は、中国版ツイッター（Twitter）の微博（ウェイボー、Weibo）に「餓え死にしそうだ」と投稿,['ある住民は、中国版ツイッター（Twitter）の微博（ウェイボー、Weibo）に「餓え死にしそうだ」と投稿']
2022-02-10 21:04:56,id_in_block_list,0,False,UCzj8dL2sWGw6uUHGnSkWqmg,潤羽ますき™︎,大嘘つきパワハラ女白上さんの臨！？,['大嘘つきパワハラ女白上さんの臨！？']
2022-02-10 21:04:56,name_2_words_msg_jp,0,False,UCrcVOjyvKoQOm5hv4fjgtPw,lemst rhode,山田ガチ恋勢他と比べたらめちゃくちゃ少な,['山田ガチ恋勢他と比べたらめちゃくちゃ少な']
2022-02-10 21:04:57,name_2_words_msg_jp,0,False,UC8XVeaqGWAL3YBXaZBY_dDA,Mincu Bintu,ホロライブJPだけ同接ナーフなんてひどいよな？ ,['ホロライブJPだけ同接ナーフなんてひどいよな？']
2022-02-10 21:04:57,id_in_block_list,0,False,UCvld1P8WaoWYz3oKhQn6Tgw,sandra giovino,好き嫌い好感度トップとかいう ,['好き嫌い好感度トップとかいう']
2022-02-10 21:04:57,name_2_words_msg_jp,0,False,UCVUpd3WDn3W4SJ9OlbHX8nA,ayalafu darryn,こよりってRPGやる気あるわけ？ ,['こよりってRPGやる気あるわけ？']
2022-02-10 21:04:58,name_2_words_msg_jp,0,False,UCKJmL9gDTBBcw_ZxPDD0ApQ,Goxia zen,8月30日にバンダイナムコエンターテインメント様より告知がありましたアイドルマスター関連作品のゲーム実況ポリシー公開について、,['8月30日にバンダイナムコエンターテインメント様より告知がありましたアイドルマスター関連作品のゲーム実況ポリシー公開について、']
2022-02-10 21:04:58,name_2_words_msg_jp,0,False,UC8vqaStGutz9Vq1C_uLfRGA,sharron bjorgen,そもそも本当にスパチャクイーン目指してるならる！を見習え ,['そもそも本当にスパチャクイーン目指してるならる！を見習え']
2022-02-10 21:04:58,name_2_words_msg_jp,0,False,UCI3yTgJmaKqTefrSD97ql7w,Hfugugg Olson,複窓したことない俺のアカウントが同接0の配信見ても0のままなのに何で要因を複窓で確定させてるんやあいつら ,['複窓したことない俺のアカウントが同接0の配信見ても0のままなのに何で要因を複窓で確定させてるんやあいつら']
2022-02-10 21:04:58,name_2_words_msg_jp,0,False,UCMhyb3TTPYd1OYjD89yUxxA,hjiyeo daero,野うさぎが必死にバグのせいにしてるの本当に冷えてそうで草 ,['野うさぎが必死にバグのせいにしてるの本当に冷えてそうで']
2022-02-10 21:04:58,name_2_words_msg_jp,0,False,UCODMRpbgYLLb-O70WW-TgcA,repos leif,こりゃ完全にスバルが王だな ぺこらの敗因は好感度差 ,"['こりゃ完全にスバルが王だな', 'ぺこらの敗因は好感度差']"
2022-02-10 21:04:58,name_2_words_msg_jp,0,False,UCYZNww9Ld3P_RqGtwj843uw,Daniel Zane,6期生はコラボ解禁したら散らばるのか？ ,['6期生はコラボ解禁したら散らばるのか？']
2022-02-10 21:04:59,name_2_words_msg_jp,0,False,UCJRq8xV7s2gukPddsmnJRIA,kenda goben,かしらの見返りを設定してお金をもらう→適法 ,['かしらの見返りを設定してお金をもらう→適法']
2022-02-10 21:04:59,name_2_words_msg_jp,0,False,UCOgJiOTM4EdPaPZo-S0InrA,rachela tuckaerad,もっと頑張ってくださいよ白上さん、そうしないと君の後ろ盾が失望するよ,['もっと頑張ってくださいよ白上さん、そうしないと君の後ろ盾が失望するよ']
2022-02-10 21:04:59,name_2_words_msg_jp,0,False,UCmnewI9r3ctWTqxnneKV90Q,bewergmann alana,いろんな人から「湊あくあのトラックみたよー！」って連絡来たりツイート,['いろんな人から「湊あくあのトラックみたよー！」って連絡来たりツイート']
2022-02-10 21:04:59,name_2_words_msg_jp,0,False,UCb9C73E_bf59mAZWVXoCOOA,leighann agustin,みこちの目撃情報がガチならかなり期待しちゃうぞ,['みこちの目撃情報がガチならかなり期待しちゃうぞ']
2022-02-10 21:04:59,name_2_words_msg_jp,0,False,UCUH-VsGbol0h-Lxaznkr2mA,ned tai,自演で勢い上げたら勝ちスレになるって言ったけどここまでしなくても… ,['自演で勢い上げたら勝ちスレになるって言ったけどここまでしなくても…']
2022-02-10 21:04:59,name_2_words_msg_jp,0,False,UCdyhZ1Hmc57s-pzhk7ddF7w,Corbin Kidd,余っさん待機で７５００あったのに戻らんやん ,['余っさん待機で７５００あったのに戻らんやん']
2022-02-10 21:04:59,name_2_words_msg_jp,0,False,UCiR6g-6HmeJjcXVtWrAufYg,washi andra,ファンでさえ歌枠なら行かないやついるのに ,['ファンでさえ歌枠なら行かないやついるのに']
2022-02-10 21:05:00,name_2_words_msg_jp,0,False,UCOkgkSjMdhZr6suyAfnZoYw,Rosemary Skye,今おる三人はムキロゼと共に神話を作るための先遣隊っぽい ,['今おる三人はムキロゼと共に神話を作るための先遣隊っぽい']
2022-02-10 21:05:00,name_2_words_msg_jp,0,False,UCd7ZguuqmGDB0l1xH2mT_Lg,David smith,俺は女の写真見ただけで服が透けて見えるようになったからなんらおかしい事じゃない ,['俺は女の写真見ただけで服が透けて見えるようになったからなんらおかしい事じゃない']
2022-02-10 21:05:00,name_2_words_msg_jp,0,False,UCcfi_CnrCP8lv-U4qDV_46A,Jeremy Knighty,これ何がえぐいってファンが傷ついてるイラストなのに褒め称えてるんだよな ,['これ何がえぐいってファンが傷ついてるイラストなのに褒め称えてるんだよな']
2022-02-10 21:05:00,name_2_words_msg_jp,0,False,UCKX4AQkLqcWjO81UTN37qww,Beatrice Harrison,ブランドを成長させた初期メンバーの功績と実力は疑われないが ,['ブランドを成長させた初期メンバーの功績と実力は疑われないが']
2022-02-10 21:05:01,name_2_words_msg_jp,0,False,UCMjB0RpxMKUaG8k21mbaHWA,Desko limba,何が起こってんねや。はよ修正しろや。ワイは常にガイドラインに従っとる。これがワイのチャンネルや」 ,['何が起こってんねや。はよ修正しろや。ワイは常にガイドラインに従っとる。これがワイのチャンネルや」']
2022-02-10 21:05:01,name_2_words_msg_jp,0,False,UC0SfGBqxV8Pf-gsVc7BWpAw,sebastian sowle,なんか知らんが記念配信も生じゃなくなってるし最近の公式関連はクソつまらんよな ,['なんか知らんが記念配信も生じゃなくなってるし最近の公式関連はクソつまらんよな']
2022-02-10 21:05:01,id_in_block_list,0,False,UCiR6g-6HmeJjcXVtWrAufYg,washi andra,僕「バンされてるのに高評価も反映されるし、アンケートも答えられるんだ、随分と都合のいいバンやね笑」 ,['僕「バンされてるのに高評価も反映されるし、アンケートも答えられるんだ、随分と都合のいいバンやね笑」']
2022-02-10 21:05:01,name_2_words_msg_jp,0,False,UCC6aE5t1jXWnlwYqVK0JDQw,freeh sibyl,ネトウヨおじさん｢…………でも山田はホロライブ舐めてるじゃん！！！！｣ ,['ネトウヨおじさん｢…………でも山田はホロライブ舐めてるじゃん！！！！｣']
2022-02-10 21:05:02,id_in_block_list,0,False,UCiEmo-xpj6rceEwrmM4vAxw,lanita ravenelle,の金コイ除けばかなたも耐久系は数字でなくなってるし ,['の金コイ除けばかなたも耐久系は数字でなくなってるし']
2022-02-10 21:05:02,name_2_words_msg_jp,0,False,UCCsEyqHPlKoEpY1_oZ7iPKg,noel hoxha,すいせい徹底マークしてアイテム使いまくらないとすいせいの勝ちだろうな ,['すいせい徹底マークしてアイテム使いまくらないとすいせいの勝ちだろうな']
2022-02-10 21:05:02,name_2_words_msg_jp,0,False,UCe7MzHfVo6QCvOiHeAko_3w,Alban Kodra,かなたん「僕だけを見て」 へい民「見てるよ」 ,"['かなたん「僕だけを見て」', 'へい民「見てるよ」']"
2022-02-10 21:05:03,name_2_words_msg_jp,0,False,UCvUpC9T7WsRBkSEK-r3VwLA,See Fuston,羽生のカリスマ性や経歴見たら確かにぺこらに似てるよな ,['羽生のカリスマ性や経歴見たら確かにぺこらに似てるよな']
2022-02-10 21:05:03,name_2_words_msg_jp,0,False,UCF0VljCgf24WaXczA8ZcKiQ,Nishu Nimaki,今おる三人はムキロゼと共に神話を作るための先遣隊っぽい ,['今おる三人はムキロゼと共に神話を作るための先遣隊っぽい']
2022-02-10 21:05:03,name_2_words_msg_jp,0,False,UCldYV9OCjbw6AlschGMMyAw,marvin homer,Twitterやまとめブログで燃やそうとしてる奴がいるけど気にしてない ,['Twitterやまとめブログで燃やそうとしてる奴がいるけど気にしてない']
2022-02-10 21:05:03,name_2_words_msg_jp,0,False,UCcWh27I9T42-BK4JaDXq_6A,Senaro fire,130ティラノくんも手に入ったし次は戦力集めだな ,['130ティラノくんも手に入ったし次は戦力集めだな']
2022-02-10 21:05:03,name_2_words_msg_jp,0,False,UCCvpCZVH6-Foc1rDHpLCEDw,likhon aseiu,ルーナも演技は普通だったけど普段とギャップあって良かったで ,['ルーナも演技は普通だったけど普段とギャップあって良かったで']
2022-02-10 21:05:03,name_2_words_msg_jp,0,False,UCNIOy4sXrUyXVt80nlp-hag,Tibo moe,再生数が予想で数千～数万の響ラジオで放送作家分赤字だけどこよりのトーク力を鍛え上げる出費はここまでかけるべきだよ ,['再生数が予想で数千～数万の響ラジオで放送作家分赤字だけどこよりのトーク力を鍛え上げる出費はここまでかけるべきだよ']
2022-02-10 21:05:03,name_2_words_msg_jp,0,False,UC28KJflkGG0whEr3m0IPbnA,Glen Osmani,3週間前の全順位配信の時はまともな走りだったのにな ,['3週間前の全順位配信の時はまともな走りだったのにな']
2022-02-10 21:05:03,name_2_words_msg_jp,0,False,UCscRbjqFk1u0mrJ9gHp9hfg,alisha stothard,ぺこちゃんいつもありがとう！アンスレ民は感謝してます,['ぺこちゃんいつもありがとう！アンスレ民は感謝してます']
2022-02-10 21:05:04,name_2_words_msg_jp,0,False,UCEeFB9HVvMER9B_Xq-UEdfg,Lauressa Pinsoneault,絶対こいつら裏で「このムーブするとガッツリ稼げるよ！」って情報交換してんだろ ,['絶対こいつら裏で「このムーブするとガッツリ稼げるよ！」って情報交換してんだろ']
2022-02-10 21:05:04,name_2_words_msg_jp,0,False,UCx2x3o8fqkRZRx4W05T2QoA,Julie Andersonh,数字が減ってもぺこらを捨てない！って路線で既に動き始めてるよ ,['数字が減ってもぺこらを捨てない！って路線で既に動き始めてるよ']
2022-02-10 21:05:04,name_2_words_msg_jp,0,False,UCxlk0HduE7o8vc6Yy-obuxQ,Ruth Rohr,一般の方々からの専用通報窓口も設置し、初動対応の迅速化に努めております。,['一般の方々からの専用通報窓口も設置し、初動対応の迅速化に努めております。']
2022-02-10 21:05:05,name_2_words_msg_jp,0,False,UCVXaeupp7PtFfQkJU_Es75Q,yadro payna,みこるしGTAが気になってアンチャに集中できそうにない ,['みこるしGTAが気になってアンチャに集中できそうにない']
2022-02-10 21:05:05,name_2_words_msg_jp,0,False,UC81mIhsyMJ3menT2w4Tp5tg,robin parizo,権利関係で歌えない歌が多少あったぐらいしか浮かばんな,['権利関係で歌えない歌が多少あったぐらいしか浮かばんな']
2022-02-10 21:05:05,name_2_words_msg_jp,0,False,UCKHgHn1ceR9VM7O3TKzryVg,reinaga corabella,画面同じだし雑談おもろないと下山してくわ ,['画面同じだし雑談おもろないと下山してくわ']
2022-02-10 21:05:06,name_2_words_msg_jp,0,False,UCKeRC0nR28R8iW79Pe4n5dA,martin buss,フブキ出た途端荒らされてたけどコメント早すぎて空気だったね ,['フブキ出た途端荒らされてたけどコメント早すぎて空気だったね']
2022-02-10 21:05:06,name_2_words_msg_jp,0,False,UCwBv8do3QM1cPtIlEBR_6fA,Jaylin dean Mariah,そらいきなりおびただしい数のガイジに囲まれたら疲弊するわ ,['そらいきなりおびただしい数のガイジに囲まれたら疲弊するわ']
2022-02-10 21:05:06,name_2_words_msg_jp,0,False,UC5dx9SAYj3kzVL9YpCxbQMg,denal freda,トワってクルーにあくあとAPEXの腕くらべられて心折れてからヴァロ配信ばかりするようになったな ,['トワってクルーにあくあとAPEXの腕くらべられて心折れてからヴァロ配信ばかりするようになったな']
2022-02-10 21:05:06,name_2_words_msg_jp,0,False,UCn51k_LfO7ZG27wQIYdAu3g,cathern grella,これで数字が減ったの見て離れてく層が多数派ならオワオワリ ,['これで数字が減ったの見て離れてく層が多数派ならオワオワリ']
2022-02-10 21:05:06,name_2_words_msg_jp,0,False,UCxGpeW2kJSaFhtULjwM09ag,Thúy Ngà Ông,二枚目の角度ならまぁまぁマリンなんじゃね ショボいゲーセンのクオリティって感じ ,"['二枚目の角度ならまぁまぁマリンなんじゃね', 'ショボいゲーセンのクオリティって感じ']"
2022-02-10 21:05:06,name_2_words_msg_jp,0,False,UCKSmjTksOHW-7eg4U30dqGw,jeky ronald,やっぱラミィは食レポ系ホロ内で一番といっていいほど質あると思うわ ,['やっぱラミィは食レポ系ホロ内で一番といっていいほど質あると思うわ']
2022-02-10 21:05:07,name_2_words_msg_jp,0,False,UCHtslrjmB1eullM6IWZZ4bQ,Brandon Woodzt,主人公湊あくあがもう一度立ち上がった時ホロライブは更に1ステージ上に上がる ,['主人公湊あくあがもう一度立ち上がった時ホロライブは更に1ステージ上に上がる']
2022-02-10 21:05:07,name_2_words_msg_jp,0,False,UC5VR6-WsjvkcWmB2rf169Lg,Moore Lynch skye,ホロライブの皆さんにはこれからも元気で配信してほしいから少しでも休んでほしい時がある！,['ホロライブの皆さんにはこれからも元気で配信してほしいから少しでも休んでほしい時がある！']
2022-02-10 21:05:07,id_in_block_list,0,False,UCb9C73E_bf59mAZWVXoCOOA,leighann agustin,ブロック報告、フィードバック送信お勧めです,['ブロック報告、フィードバック送信お勧めです']
2022-02-10 21:05:07,name_2_words_msg_jp,0,False,UCIw8cyDvc1QdA9oTmdmKjHA,Герман hay,ホロスタENの一部が韓国人だった ,['ホロスタENの一部が韓国人だった']
2022-02-10 21:05:07,name_2_words_msg_jp,0,False,UCAz577vlqkY2s4xlN8VkRgQ,Everett Spillane,魂の歌い手の方でリアイベしまくってるんだからリスク意識低すぎだわ ,['魂の歌い手の方でリアイベしまくってるんだからリスク意識低すぎだわ']
2022-02-10 21:05:07,name_2_words_msg_jp,0,False,UCmYPKk2XkdsUpbzHzLu8B7A,Schweitzer Pei,スタンプに限らず草とかも怪しいと思う ,['スタンプに限らずとかも怪しいと思う']
2022-02-10 21:05:08,name_2_words_msg_jp,0,False,UCG_iUmU5SWgalI5ZLAiX7Aw,ferendo danuska,フランスがワクチン接種を義務化へ。,['フランスがワクチン接種を義務化へ。']
2022-02-10 21:05:07,name_2_words_msg_jp,0,False,UCffTLChT65TFcxkrgkYzuGg,Robinetta Hayes Kassie,同接半減バグだったらコジマ店員の同接14000になっちゃうんだけど,['同接半減バグだったらコジマ店員の同接14000になっちゃうんだけど']
2022-02-10 21:05:08,name_2_words_msg_jp,0,False,UChqujNkN4Atxc3-_o513A6w,Tari Paterson,後は配信するなら金(スパチャ)が欲しいって思考が薄い ,['後は配信するなら金(スパチャ)が欲しいって思考が薄い']
2022-02-10 21:05:08,name_2_words_msg_jp,0,False,UCKI8FwA1lCs7LTY2HTqKO1w,Gazmir Brahimi,ホロライブ最近ARKやり出してからまたさらに人気上昇してるな ,['ホロライブ最近ARKやり出してからまたさらに人気上昇してるな']
2022-02-10 21:05:08,name_2_words_msg_jp,0,False,UCIXkiU98sMNXLS4nWvxD4mg,lakeisha karney,もそも運営に止めるメリットなんて一つもないからそんなの信じてるの改行ガイジレベルのキチガイだけだろ ,['もそも運営に止めるメリットなんて一つもないからそんなの信じてるの改行ガイジレベルのキチガイだけだろ']
2022-02-10 21:05:08,name_2_words_msg_jp,0,False,UCq22H939oOorG6uSCMqlnHg,Orgest Baku,そのぺっさんは数千万は納税してる上級国民だけどお前の去年の納税額は？ ,['そのぺっさんは数千万は納税してる上級国民だけどお前の去年の納税額は？']
2022-02-10 21:05:08,name_2_words_msg_jp,0,False,UCgAaLMe-bTnm0gUbyndJIjw,babbi adi,結論から言うと多重窓で10窓くらいして、ここで決めた枠を一斉に多重するんだ ,['結論から言うと多重窓で10窓くらいして、ここで決めた枠を一斉に多重するんだ']
2022-02-10 21:05:08,name_2_words_msg_jp,0,False,UCUPQiOL4wmV7ynLQfua8KXA,audra yamane,ホロライブ皆さんのお陰でこの1年楽しく過ごせたな〜,['ホロライブ皆さんのお陰でこの1年楽しく過ごせたな〜']
2022-02-10 21:05:09,name_2_words_msg_jp,0,False,UC3W7Bsd5Vqm5eWXmgpgl9YQ,Kawesd Fgdyti,おばあちゃん家のにおいがしそう ,['おばあちゃん家のにおいがしそう']
2022-02-10 21:05:09,name_2_words_msg_jp,0,False,UCJy1pm_bSLHV_6yI7B8CJ1Q,porfirio garlock, 俺が応援して大きくしたいみたいな意識が強いのかねスパチャ民は ,['俺が応援して大きくしたいみたいな意識が強いのかねスパチャ民は']
2022-02-10 21:05:09,name_2_words_msg_jp,0,False,UCEn4Sp3r5ADhJy6P3HU1RrA,cande laine,やっぱりどうしてもホロライブに詳しい人ばかりとは限らない、もちろんこれまでの ,['やっぱりどうしてもホロライブに詳しい人ばかりとは限らない、もちろんこれまでの']
2022-02-10 21:05:09,name_2_words_msg_jp,0,False,UCRP3tcWjI0zqhbeoj2BFkUQ,sial feroa,地方から来たファンがコロナお土産に帰ってくるとか ,['地方から来たファンがコロナお土産に帰ってくるとか']
2022-02-10 21:05:10,name_2_words_msg_jp,0,False,UCJA7dLWrWvVhv3jwLnRuhCg,luci seats,ペクスの新モード最高だよ お祭り感好きなやつはオススメ ,"['ペクスの新モード最高だよ', 'お祭り感好きなやつはオススメ']"
2022-02-10 21:05:10,id_in_block_list,0,False,UCuaMvQ3kapf-QIfn9hO_AEQ,Aryana Franco,カバーが東京にこんなデカい事務所を借りておいて　SC落ちるわコラボ商品売り残るわで,['カバーが東京にこんなデカい事務所を借りておいて\u3000SC落ちるわコラボ商品売り残るわで']
2022-02-10 21:05:10,name_2_words_msg_jp,0,False,UCvZlMvcRrizrz-kNO22viYA,Conrad Watson,ときのそらたち姉妹によるユニット＝ジ・エイプリルフールズを結成し、,['ときのそらたち姉妹によるユニット＝ジ・エイプリルフールズを結成し、']
2022-02-10 21:05:10,name_2_words_msg_jp,0,False,UCyKzuNNLyIM11PbfxxV1LDw,kemo Paul,心の内に秘めといてねって、風真の見えないとこでやってね～って、言ったよね～？ ,['心の内に秘めといてねって、風真の見えないとこでやってね～って、言ったよね～？']
2022-02-10 21:05:10,name_2_words_msg_jp,0,False,UCx1W4tLQQm2UKOQBHsTuT9A,berry soil,ガチ恋は、風真の見えないところでやってください、て皆殿言ったよね？ ,['ガチ恋は、風真の見えないところでやってください、て皆殿言ったよね？']
2022-02-10 21:05:10,name_2_words_msg_jp,0,False,UC8Np68hkd8lv_-eM9qwKtDA,morej oriva,そもそも買ったときの値段を基準に考えるあらゆる行為が間違い,['そもそも買ったときの値段を基準に考えるあらゆる行為が間違い']
2022-02-10 21:05:11,name_2_words_msg_jp,0,False,UCCiV-bTQfuGJoB2g87ZmXZA,loch fiona,そう考えると音声もミラーしてたゆびふり大会のスウジーっぷりがヤバイな,['そう考えると音声もミラーしてたゆびふり大会のスウジーっぷりがヤバイな']
2022-02-10 21:05:11,name_2_words_msg_jp,0,False,UC3JZIZUKF7Fv1-aHpxHnhBw,parseliva quento,ラミポルの登録者の伸び見てると面白いな ,['ラミポルの登録者の伸び見てると面白いな']
2022-02-10 21:05:11,name_2_words_msg_jp,0,False,UC97xf4mPoNUry3XcW0UFLgg,Rogersjh Demetria,該当の誹謗中傷系VTuberが異議申し立てを断念する意向を示していることが判明しました。,['該当の誹謗中傷系VTuberが異議申し立てを断念する意向を示していることが判明しました。']
2022-02-10 21:05:11,name_2_words_msg_jp,0,False,UCorTNGXA0H3klbHUf0ZpWEw,jamey murawski,普段の配信でこれだけ出せたらホロガイも同接どりゃできなくて壊滅だから ,['普段の配信でこれだけ出せたらホロガイも同接どりゃできなくて壊滅だから']
