datetime,reason,weight,is_member,channel_id,author_name,message,processed_msg
2022-02-10 21:04:13,name_2_words_msg_jp,0,False,UCrodLlemZerR44VY6tDF-vw,Mitsue Luangrath,にじアンスレ覗くとあっちは同接4000でも3000でも配信やってれば実況してんだよな ,['にじアンスレ覗くとあっちは同接4000でも3000でも配信やってれば実況してんだよな']
2022-02-10 21:04:12,name_2_words_msg_jp,0,False,UCB3zoW55ILwpftuXcgb2RWw,Gracie Reyes,幸せそうだねぇ羨ましいよ君みたいな単純な人間が ,['幸せそうだねぇ羨ましいよ君みたいな単純な人間が']
2022-02-10 21:04:13,name_2_words_msg_jp,0,False,UCrK2r7TxokEJY2OzRM1PbTg,La noble,こんなに可愛いフブキさんに会えるならゲームのお金めっちゃあったけど安いもんよ！,['こんなに可愛いフブキさんに会えるならゲームのお金めっちゃあったけど安いもんよ！']
2022-02-10 21:04:13,name_2_words_msg_jp,0,False,UC-rzC8Ggpk0YG-q2a5tP8LA,Bella Enfinger,しゃかまたはなんでポケキッズ全員寝てる時間にポケモンやるんだよ,['しゃかまたはなんでポケキッズ全員寝てる時間にポケモンやるんだよ']
2022-02-10 21:04:13,name_2_words_msg_jp,0,False,UCdGQh1xQFyE7jRrYkd0vy3A,portli brott,全ての宣伝なんかできるわけないんだから ,['全ての宣伝なんかできるわけないんだから']
2022-02-10 21:04:13,name_2_words_msg_jp,0,False,UCpbmUCOHhJ2tFWDdKUR3A5g,stephania harbuck,賛成した法律なのに自分ではそんなに。そういうつもりではないって思っても。周りがやっぱり。フブキは今。ホロライブのトップだからって言われて。,['賛成した法律なのに自分ではそんなに。そういうつもりではないって思っても。周りがやっぱり。フブキは今。ホロライブのトップだからって言われて。']
2022-02-10 21:04:13,name_2_words_msg_jp,0,False,UCilieK_tDuI0v1lHpb3oe-w,Reayu Etsgisb,全員オワコンになれば以前みたいにホロメン同士もリスナー同士もにじホロライバー,['全員オワコンになれば以前みたいにホロメン同士もリスナー同士もにじホロライバー']
2022-02-10 21:04:14,name_2_words_msg_jp,0,False,UCsn1Jc61Q-BEfOgj-9BK6Sw,Faviola Schwartzman,くっせぇ女好きだからはあちゃまに顔踏まれたいし親方の脇舐めまわしたいしあくたんとディープキスしたいわ。ほかに臭いホロメンって居たっけ？ ,['くっせぇ女好きだからはあちゃまに顔踏まれたいし親方の脇舐めまわしたいしあくたんとディープキスしたいわ。ほかに臭いホロメンって居たっけ？']
2022-02-10 21:04:14,name_2_words_msg_jp,0,False,UC_tqGGcdJbPI1Ha7XIb_GMQ,kebda gustea,お前ら全員、俺ほど彼女を愛していないから、ほしよみを名乗る資格はない。 ,['お前ら全員、俺ほど彼女を愛していないから、ほしよみを名乗る資格はない。']
2022-02-10 21:04:14,name_2_words_msg_jp,0,False,UCZUV9KpGEDTsZ8KwnGVZFzg,Bond Silver doreen,はあちゃまか誰かも言ってたわ、この占いはただのカウンセリングだって ,['はあちゃまか誰かも言ってたわ、この占いはただのカウンセリングだって']
2022-02-10 21:04:14,name_2_words_msg_jp,0,False,UCHCwsefLkNe0CnGNkhNUxZw,Lloyd Wiles,すこしでも迂闊な事言ったら燃やされるんだからそりゃ当たり障りない事言って終わるでしょ,['すこしでも迂闊な事言ったら燃やされるんだからそりゃ当たり障りない事言って終わるでしょ']
2022-02-10 21:04:14,name_2_words_msg_jp,0,False,UC3Zra8cW57utL9CmoeJdWTA,harriett peleg,ありがとう、お嬢に出会えて本当に良かった！ホロメンのみんなは独自の特徴があり、お互いがお互いの世話をする、ホロライプの雰囲気も好きけど、好きの相手は1つだけ。,['ありがとう、お嬢に出会えて本当に良かった！ホロメンのみんなは独自の特徴があり、お互いがお互いの世話をする、ホロライプの雰囲気も好きけど、好きの相手は1つだけ。']
2022-02-10 21:04:15,name_2_words_msg_jp,0,False,UCUgKqyAEfFpijUILcDlTM1Q,Berry pena Ava,たぁしゃま普段好きじゃないけど コウモリ食った？ ,"['たぁしゃま普段好きじゃないけど', 'コウモリ食った？']"
2022-02-10 21:04:15,name_2_words_msg_jp,0,False,UCM7jtxe4siX5B7CD_uTokrQ,Neda Reynolds,まあ魂の方が分かってる前提で喋ることはあるかもしれんが普通に推してる分には魂に行き着くことってそんななくないか ,['まあ魂の方が分かってる前提で喋ることはあるかもしれんが普通に推してる分には魂に行き着くことってそんななくないか']
2022-02-10 21:04:15,name_2_words_msg_jp,0,False,UC_RHGmx5Emsz1GVQHqKAjkQ,odine lam,自称古参「リアクト時代の山田はサボり魔！ホロもすぐ飽きて配信しなくなるよ！」 ,['自称古参「リアクト時代の山田はサボり魔！ホロもすぐ飽きて配信しなくなるよ！」']
2022-02-10 21:04:15,name_2_words_msg_jp,0,False,UC3ClRF5yZsA0Kxp7tT5_Gcg,goude elsa,日本のネトウヨなんてかわいいもんでその10倍ぐらいナチュラルに差別してくるし ,['日本のネトウヨなんてもんでその10倍ぐらいナチュラルに差別してくるし']
2022-02-10 21:04:15,name_2_words_msg_jp,0,False,UCxx1HTVSMB48lDvZv5AkeMw,selly fola,だからコナーが成功したのは色々な要因があるんだろ？ ,['だからコナーが成功したのは色々な要因があるんだろ？']
2022-02-10 21:04:15,name_2_words_msg_jp,0,False,UCcjzsYvvolyBLAMgQaEngTQ,laquita felipa,クルーるしあの待機所まで荒らすのかほんと害悪だな ,['クルーるしあの待機所まで荒らすのかほんと害悪だな']
2022-02-10 21:04:15,name_2_words_msg_jp,0,False,UCB1zttbKloaETCZr2DqBFLg,Albirt strome,２つくらいのトピック進行しながら隙あらば誰かを煽り、スレの各所で全く関係ない話題でガイジ同士がそれぞれ喧嘩しとる ,['２つくらいのトピック進行しながら隙あらば誰かを煽り、スレの各所で全く関係ない話題でガイジ同士がそれぞれ喧嘩しとる']
2022-02-10 21:04:15,name_2_words_msg_jp,0,False,UCaQzTCAduvbs_rKWI2lbZrQ,Ermir Kodra,ぺっさんって実況力は高いけどやるゲームがことごとくクソなのはどうしてなん？ ,['ぺっさんって実況力は高いけどやるゲームがことごとくクソなのはどうしてなん？']
2022-02-10 21:04:16,name_2_words_msg_jp,0,False,UCRFdErDaiGOQ65aoW_JGj5g,rico rohrbaugh,男性は鉛筆やボールペン、針など細く鋭利な物が多く、女性は比較的滑らかな物を好む傾向があるようです。 ,['男性は鉛筆やボールペン、針など細く鋭利な物が多く、女性は比較的滑らかな物を好む傾向があるようです。']
2022-02-10 21:04:16,name_2_words_msg_jp,0,False,UCIz8gB1JbZNR6Og_WBGCgKA,Mark Woodse,相手の自爆で勝ち続け優勝するルイ ,['相手の自爆で勝ち続け優勝するルイ']
2022-02-10 21:04:16,name_2_words_msg_jp,0,False,UC1hQum-POAaVmnw-BkaiEJQ,toelk damon,とうすこに見つからないようにって理由よりは「,['とうすこに見つからないようにって理由よりは「']
2022-02-10 21:04:16,name_2_words_msg_jp,0,False,UCX-58f5qy9jFMUSIucF60fA,chu emma,3期生が集まってインディアンポーカーして、船長が負けてる感じかな？ みんな可愛い,"['3期生が集まってインディアンポーカーして、船長が負けてる感じかな？', 'みんな可愛い']"
2022-02-10 21:04:16,name_2_words_msg_jp,0,False,UCGr3W4jA43xjIg3UruXVnZg,dazzle samuel,まつりちゃんやエクスの価値も高い ,['まつりちゃんやエクスの価値も高い']
2022-02-10 21:04:16,name_2_words_msg_jp,0,False,UCkhCsCimlgQmziew4u8QLHw,Viroy quero,イヴちゃんは実在する女の子で話したことがある ,['イヴちゃんは実在する女の子で話したことがある']
2022-02-10 21:04:16,name_2_words_msg_jp,0,False,UCaSiWHCfnTvVs889AX3M73A,edi kola,みこの家でゴリラが大量繁殖してる中シオンが雑談しながら配信してる近,['みこの家でゴリラが大量繁殖してる中シオンが雑談しながら配信してる近']
2022-02-10 21:04:17,name_2_words_msg_jp,0,False,UCoYMHvbRLNzH1AOwUBCgCzg,Georgianne Dartt,バトル系の漫画って話が進むと絶対前より強い敵を出さなきゃいけないのがつらいよな ,['バトル系の漫画って話が進むと絶対前より強い敵を出さなきゃいけないのがつらいよな']
2022-02-10 21:04:17,name_2_words_msg_jp,0,False,UCGh-KuzMNQQpwf5jRINMoZg,isabell channing,あくたんは被害者 ねねが元凶 誰がどう見てもこれだろ 議論する余地もなくないか？ ,"['あくたんは被害者', 'ねねが元凶', '誰がどう見てもこれだろ', '議論する余地もなくないか？']"
2022-02-10 21:04:17,name_2_words_msg_jp,0,False,UCxEZSBdxBfY0RcRJd-8cZ-Q,Богдан tabi,下はルーナがスバルに夢中で、右の席は右の席で固まって楽しんでるから自分に話しかけられることはない ,['下はルーナがスバルに夢中で、右の席は右の席で固まって楽しんでるから自分に話しかけられることはない']
2022-02-10 21:04:17,name_2_words_msg_jp,0,False,UCv50U_OZTxU9P2WSBObhs-Q,Damon Thurlhvj,余っさん待機で７５００あったのに戻らんやん ,['余っさん待機で７５００あったのに戻らんやん']
2022-02-10 21:04:17,name_2_words_msg_jp,0,False,UCH9yHxkuNXvnfyRfUbEcSJg,Cheryl wade,昔ってアフィの標的マリンだった気するけど最近明らかぺこらだな ,['昔ってアフィの標的マリンだった気するけど最近明らかぺこらだな']
2022-02-10 21:04:17,name_2_words_msg_jp,0,False,UCl5xVKMgu6y6-QXmYoNTY2A,Kasey Moloney,最強メルの肉の棒 なんJ、勢い1位　今すぐ移住し,"['最強メルの肉の棒', 'なんJ、勢い1位\u3000今すぐ移住し']"
2022-02-10 21:04:17,name_2_words_msg_jp,0,False,UCBrnN8Zna__Aq0Xd22Z5yMQ,shaun moland,ん中の上下は話し相手いなくて詰むパターンだよこれ ,['ん中の上下は話し相手いなくて詰むパターンだよこれ']
2022-02-10 21:04:17,name_2_words_msg_jp,0,False,UCJDIlBABxtf5UCEqL6soFZA,Eddie Wildes,幸せそうだねぇ羨ましいよ君みたいな単純な人間が ,['幸せそうだねぇ羨ましいよ君みたいな単純な人間が']
2022-02-10 21:04:18,name_2_words_msg_jp,0,False,UCTcF82tidvn2lRHZX4wjFEA,mewlass alon,まぁ面白さに関しては今後改善されていく可能性は無くもないから… ,['まぁ面白さに関しては今後改善されていく可能性は無くもないから…']
2022-02-10 21:04:18,name_2_words_msg_jp,0,False,UCCNMAS55j1NZgM1V4ajYALg,miquel trochesset,去年散々「なんでぺこら以外の3期の奴らはぺこらの新衣装の話を言わないんだ？,['去年散々「なんでぺこら以外の3期の奴らはぺこらの新衣装の話を言わないんだ？']
2022-02-10 21:04:18,name_2_words_msg_jp,0,False,UCRMYd2SMc_l1LoIVBs5mJUw,brosn deway,医療行為が原因の異物は出産に関連する産婦人科手術に起因するものが多いので、,['医療行為が原因の異物は出産に関連する産婦人科手術に起因するものが多いので、']
2022-02-10 21:04:18,name_2_words_msg_jp,0,False,UC91Vt_fC6DkVUWvQ2moKcvg,Roland Myftiu,社会的に抹消してやるは脅迫罪になるからアキくんが証拠を握ってたら逆に相手に法の裁きを受けさせることができるぞ ,['社会的に抹消してやるは脅迫罪になるからアキくんが証拠を握ってたら逆に相手に法の裁きを受けさせることができるぞ']
2022-02-10 21:04:18,name_2_words_msg_jp,0,False,UCWHWDOG5vePIB-m3cr1saEA,Sumona Khatun,それにアンタタチが嫌な思いしていたら ,['それにアンタタチが嫌な思いしていたら']
2022-02-10 21:04:18,name_2_words_msg_jp,0,False,UC6xksmnhXpPtbFh6rff9eMA,Diane nguye,今のみこ7000ぺこら16000なんてむしろ内容のゴミさに比べたら多く感じるレベル ,['今のみこ7000ぺこら16000なんてむしろ内容のゴミさに比べたら多く感じるレベル']
2022-02-10 21:04:18,name_2_words_msg_jp,0,False,UCXXzn_X5rm641MaQ3inLc7w,Presensia niumil,ぺこらが遊戯王やったら5万出してあくあ倒せるだろ ,['ぺこらが遊戯王やったら5万出してあくあ倒せるだろ']
2022-02-10 21:04:18,name_2_words_msg_jp,0,False,UCp2i-07r3kXqFupbZROloaA,Tuyết Vân Giàng,ホロ2年見続けた俺が断言するけど6期の精神的支えになるよ ,['ホロ2年見続けた俺が断言するけど6期の精神的支えになるよ']
2022-02-10 21:04:18,name_2_words_msg_jp,0,False,UCRCFDA1ZhnKH7RtFV_9LLpQ,Crystal bella,定期的にこのスレでホロメンに関するアンケートを行おうとする人が来るけど ,['定期的にこのスレでホロメンに関するアンケートを行おうとする人が来るけど']
2022-02-10 21:04:18,name_2_words_msg_jp,0,False,UCNGSWsN7RAajxyS1cuJKKSg,Gersi Dedja,いつものキャラ可愛いおもしろ～い確定 ,['いつものキャラ可愛いおもしろ～い確定']
2022-02-10 21:04:19,name_2_words_msg_jp,0,False,UCLo6-SCAsSicBNyqz7f6SRQ,Xander Pena,新衣装はトワやぼっさんみたいにずっとSSRの神引き続けられたら良いけど ,['新衣装はトワやぼっさんみたいにずっとSSRの神引き続けられたら良いけど']
2022-02-10 21:04:19,name_2_words_msg_jp,0,False,UCe8V4SxzYTc1uMJmZOA4Qhg,joura treso,それを失った時に硬直化してしまう。変化を楽しもう^^,['それを失った時に硬直化してしまう。変化を楽しもう^^']
2022-02-10 21:04:19,name_2_words_msg_jp,0,False,UCr8uFJ3GlsbQ1Aij5bJdsgg,Hugh Ondog,何を以って正確なのかは分からんが ,['何を以って正確なのかは分からんが']
2022-02-10 21:04:19,name_2_words_msg_jp,0,False,UCLbl5a8zaGo4lz45i66O7Ng,loundang thresa,アンチの考え方がよく分かるレスだわ ,['アンチの考え方がよく分かるレスだわ']
2022-02-10 21:04:19,name_2_words_msg_jp,0,False,UChrAI7Ihbo7GRTJ4g1VY9vg,Thùy Mi Hà,今ホロの切り抜きチャンネルの収益化が剥がされたりインプレッション制限受けてるらしいな ,['今ホロの切り抜きチャンネルの収益化が剥がされたりインプレッション制限受けてるらしいな']
2022-02-10 21:04:19,name_2_words_msg_jp,0,False,UC-uLDg5j8pr5bzCzpZ8CFYw,Edwards Higgins jon,この世の中電通関わってるもんばっかりで大抵の人間それわかって騒いでると思うけどたまにガチっぽい奴おるよね ,['この世の中電通関わってるもんばっかりで大抵の人間それわかって騒いでると思うけどたまにガチっぽい奴おるよね']
2022-02-10 21:04:19,name_2_words_msg_jp,0,False,UCIyataTyRHP0jqAYm1ssH5A,taylor battaglino,山信「なんで他のホロメンも魂やってるのに山田はダメなの？」 ,['山信「なんで他のホロメンも魂やってるのに山田はダメなの？」']
2022-02-10 21:04:19,name_2_words_msg_jp,0,False,UCkBEj93vpk1NkM7BQ9gmQ4w,Douglas Spencers,gumi Cryptos Capitalの自慢はアップサイドのパフォーマンス以上に、ほぼ全てがプロダクトローンチまで行っている成功率の高さ,"['gumi', 'Cryptos', 'Capitalの自慢はアップサイドのパフォーマンス以上に、ほぼ全てがプロダクトローンチまで行っている成功率の高さ']"
2022-02-10 21:04:20,name_2_words_msg_jp,0,False,UCbyZKuPX9fR1XpzqTkvMAcw,aubrey waldschmidt,ラプラスは喋り方が気持ち悪いから無理 ,['ラプラスは喋り方が気持ち悪いから無理']
2022-02-10 21:04:20,name_2_words_msg_jp,0,False,UCwnB1KwWL01Hm_NyJwtTTQg,ashlyn haroun,カバー株式会社では、昨年度より所属タレントに対する節度を超えた権利侵害·詐誇中傷行為に対して、,['カバー株式会社では、昨年度より所属タレントに対する節度を超えた権利侵害·詐誇中傷行為に対して、']
2022-02-10 21:04:20,name_2_words_msg_jp,0,False,UC7-p09EEeMU8gPUULP9276g,Sormista Jahann,チキン用意して凸待ち0人芸とかすればいいのに ,['チキン用意して凸待ち0人芸とかすればいいのに']
2022-02-10 21:04:20,name_2_words_msg_jp,0,False,UCwlrKqSOZEXJABgxW67c-dA,Marian Mckenzieyu,幸い同接バグって数字追求する意味無くなって短時間で終わったのが功を奏したな ,['幸い同接バグって数字追求する意味無くなって短時間で終わったのが功を奏したな']
2022-02-10 21:04:21,name_2_words_msg_jp,0,False,UCeyhZ5tCOzo3wqYhj67ONyg,epifania plotzker,二人に見せて一人でずっとこれ○○って連投やってるからな ,['二人に見せて一人でずっとこれ○○って連投やってるからな']
2022-02-10 21:04:21,name_2_words_msg_jp,0,False,UCiRPdkVv5nY5d8JoZsV3a_g,Mark Porters,普段から荒らせないとか垢買う金ないのか ,['普段から荒らせないとか垢買う金ないのか']
2022-02-10 21:04:21,name_2_words_msg_jp,0,False,UC2xcVdiPORs07Z-XhdPvTrg,Jodan head Kohen,"以外ってのは ""それ""を覗いたものだから それに当てはまるのはこよりじゃなくて ペこマリスバみこだよ:smiling_face: ","['以外ってのは', '""それ""を覗いたものだから', 'それに当てはまるのはこよりじゃなくて', 'ペこマリスバみこだよ']"
2022-02-10 21:04:21,name_2_words_msg_jp,0,False,UCfeG_C61H5wPya0ZVMSjmWQ,Zackary Coppola,こよたちのような新人の6期生、holoXを見に来てくれる人って ,['こよたちのような新人の6期生、holoXを見に来てくれる人って']
2022-02-10 21:04:21,name_2_words_msg_jp,0,False,UCvA6tixxDp1y6mscAgQouWg,Pia Macneal,企画は叩かれる上にスケジュール調整するだけでクソ面倒そうなのがな ,['企画は叩かれる上にスケジュール調整するだけでクソ面倒そうなのがな']
2022-02-10 21:04:21,name_2_words_msg_jp,0,False,UCm5Y1_0taVXZ8OYjBr8DkIQ,Stephanie Wynterg,鉛筆やボールペンの芯なども多く、太い物が入らない穴だけに挿入される物が細長くなる傾向があるようです。,['鉛筆やボールペンの芯なども多く、太い物が入らない穴だけに挿入される物が細長くなる傾向があるようです。']
2022-02-10 21:04:21,name_2_words_msg_jp,0,False,UC-t1a0updC0EEkpVL4i-szA,Andi Gjoni,日に日にバグ酷なっててワロタ youtubeくん逆ギレしてるだろこれ ,"['日に日にバグ酷なっててワロタ', 'youtubeくん逆ギレしてるだろこれ']"
2022-02-10 21:04:21,name_2_words_msg_jp,0,False,UCAOVZuagMkG2VnwgP4qBoUQ,Nguyen vu Nguyen,ボロアパートでゴキブリ育成開始 ,['ボロアパートでゴキブリ育成開始']
2022-02-10 21:04:21,id_in_block_list,0,False,UC_Nqi-UHLYWowNjQvC8tQZg,Adam Owensy,白上フブキ案件最強！！！！,['白上フブキ案件最強！！！！']
2022-02-10 21:04:21,name_2_words_msg_jp,0,False,UCdK5rUpk03Rmx5r0E4BI5XQ,lala meservy,声が可愛くてもあの性格じゃ性の対象には見れないから。 ,['声が可愛くてもあの性格じゃ性の対象には見れないから。']
2022-02-10 21:04:22,name_2_words_msg_jp,0,False,UCD1_grrLMaN2gDyAQh7_OAg,Edytha Blahnik,前回から大して時間経ってないのにあんな下手になることある？ ,['前回から大して時間経ってないのにあんな下手になることある？']
2022-02-10 21:04:22,name_2_words_msg_jp,0,False,UCw5v_epTmDGdMMJ_1mnT6iQ,matlo rusty,合コンがメインならすんません余計なお世話っしただけど ,['合コンがメインならすんません余計なお世話っしただけど']
2022-02-10 21:04:22,name_2_words_msg_jp,0,False,UCKeh3UI6iMgBIsgs--NMktg,Haynes black Watts,1億9千万稼いだVの中身は元マホトの彼女,['1億9千万稼いだVの中身は元マホトの彼女']
2022-02-10 21:04:22,name_2_words_msg_jp,0,False,UChcrq3ojYPROWUguMgBj1cA,nighu reoul,リリエル時代からこういうの割とよくあったからちょっと同情込みで笑えてくるわ ,['リリエル時代からこういうの割とよくあったからちょっと同情込みで笑えてくるわ']
2022-02-10 21:04:22,name_2_words_msg_jp,0,False,UC5WPjUMLC3qgDSiIe8IPfQg,Lorik Dedja,まつりの好き嫌いってメン限やファンディスコにもスパイ送り込んでその内容叩いてるし ,['まつりの好き嫌いってメン限やファンディスコにもスパイ送り込んでその内容叩いてるし']
2022-02-10 21:04:22,name_2_words_msg_jp,0,False,UC6kzGnkGfNlH1BiujFvtqLg,yolanda rachael,など、至極真っ当な感想が並ぶ。しかし、ホロライブとのコラボですっかり仲間意識を持ったオタクは、,['など、至極真っ当な感想が並ぶ。しかし、ホロライブとのコラボですっかり仲間意識を持ったオタクは、']
2022-02-10 21:04:22,name_2_words_msg_jp,0,False,UCXEAPOqYOv4ng-vQIdDpiyQ,hugh minaai,にじとか774はばんばん生3Dやってんのに ,['にじとか774はばんばん生3Dやってんのに']
2022-02-10 21:04:23,name_2_words_msg_jp,0,False,UCCEiqqnPG9V971PhaOOm4jg,foink rwiuo,にじは事務所が同接に異常に執着してるからしょうがないけど ,['にじは事務所が同接に異常に執着してるからしょうがないけど']
2022-02-10 21:04:23,name_2_words_msg_jp,0,False,UCSYWdAtA5O3476xq4X3VaSA,serra clark,ミオしゃ俺が見てないところでイッちまったのかよ… 時間考えようや ,"['ミオしゃ俺が見てないところでイッちまったのかよ…', '時間考えようや']"
2022-02-10 21:04:23,name_2_words_msg_jp,0,False,UCGnFFk7fLkr4jObfbKWJIaQ,Tara Cason,すまん、同接クイーンの座から落ちたぺこらはこれからじわじわと箱内での求心力・特別感も失うと思うけど ,['すまん、同接クイーンの座から落ちたぺこらはこれからじわじわと箱内での求心力・特別感も失うと思うけど']
2022-02-10 21:04:23,name_2_words_msg_jp,0,False,UCTROeLvhG3QNJQpHiZl2a_w,dorathy brandis,ff14みたいなのを案件貰えないなら辞めるだろ？,['ff14みたいなのを案件貰えないなら辞めるだろ？']
2022-02-10 21:04:23,name_2_words_msg_jp,0,False,UCb5txEJlzNnimLRR85y9dpA,dallas hupy,今日の21時までぐらいには仕様変更した方がいいんじゃないかー？ ,['今日の21時までぐらいには仕様変更した方がいいんじゃないかー？']
2022-02-10 21:04:23,name_2_words_msg_jp,0,False,UCJ1mUwcBzWk2UqZJQEVl0nA,georgeanna halbershtam,五輪で久々にサンジュスレ復活したらガチのネトウヨ沸いてきて地獄だったわ ,['五輪で久々にサンジュスレ復活したらガチのネトウヨ沸いてきて地獄だったわ']
2022-02-10 21:04:23,name_2_words_msg_jp,0,False,UCEubF_noVG91liAbiz4RBJQ,rudolf condrey,最協ではきゅぴ＞のあボラなの見るにオーダーが最重要だから ,['最協ではきゅぴ＞のあボラなの見るにオーダーが最重要だから']
2022-02-10 21:04:24,name_2_words_msg_jp,0,False,UCEmYn3YIzStZGHdTw6tCucQ,carlii giolluy, 統計的調査を行った医師も複数いて、男女比は男性60.9％に対して女性39.1％で肛門異物の男女比が171：9で女性が5.2%しか居ないのと比較すると男女差が小さいと言えます。 ,['統計的調査を行った医師も複数いて、男女比は男性60.9％に対して女性39.1％で肛門異物の男女比が171：9で女性が5.2%しか居ないのと比較すると男女差が小さいと言えます。']
2022-02-10 21:04:24,name_2_words_msg_jp,0,False,UCX4FNfNOo3pRqZ3HFehIBFA,esperanza demoss,ホロで人気のラプラスの魂だから中岡に価値があるんだぞ ,['ホロで人気のラプラスの魂だから中岡に価値があるんだぞ']
2022-02-10 21:04:24,name_2_words_msg_jp,0,False,UCkU1AXE2XYN2NczCNQLU-dQ,belly martin,なんか知らんが記念配信も生じゃなくなってるし最近の公式関連はクソつまらんよな ,['なんか知らんが記念配信も生じゃなくなってるし最近の公式関連はクソつまらんよな']
2022-02-10 21:04:24,name_2_words_msg_jp,0,False,UC_uJwaR7gXG3KV2pZAPReiQ,saturnina quiring,ロリがヒトデ擦ってるのしか覚えてない ,['ロリがヒトデ擦ってるのしか覚えてない']
2022-02-10 21:04:24,name_2_words_msg_jp,0,False,UCCzy5YYpRHkSrpaRfYryj4w,Reynaldo Mellott,一番幼女見てる気分になるのがファウナ ,['一番幼女見てる気分になるのがファウナ']
2022-02-10 21:04:25,name_2_words_msg_jp,0,False,UCNweUsHufWt-YGoKXrt1dqg,Aleisha Newcom,ホロスタENとENが普通にコラボする ,['ホロスタENとENが普通にコラボする']
2022-02-10 21:04:25,name_2_words_msg_jp,0,False,UCjlU77PnfkzvoFsZONQAnlQ,Edward Stephenso,ファンでさえ歌枠なら行かないやついるのに ,['ファンでさえ歌枠なら行かないやついるのに']
