datetime,reason,weight,is_member,channel_id,author_name,message,processed_msg
2022-03-07 19:04:38,name_2_words_msg_jp,0,False,UCrMdU92s0cKUycfX7QfjhtQ,alouer aseui,そうなのに未だに人気なのびっくりするわ ,['そうなのに未だに人気なのびっくりするわ']
2022-03-07 19:04:39,name_2_words_msg_jp,0,False,UCtqwtgpMje49U1Xxw5MTOQQ,Shudvs Mdshis,でもぺこーらは何も悪いことしてない ,['でもぺこーらは何も悪いことしてない']
2022-03-07 19:04:41,name_2_words_msg_jp,0,False,UCBK6vzvp_hCufzPTXpygw1Q,Trâm Anh Ngô,やっぱりどうしてもホロライブに詳しい人ばかりとは限らない、もちろんこれまでの ,['やっぱりどうしてもホロライブに詳しい人ばかりとは限らない、もちろんこれまでの']
2022-03-07 19:04:42,id_in_block_list,0,False,UC7ec1mCBmsnw3vBTIORREiA,Phượng Vũ Ông,山田最強だわござるとかこよりとかいらん 一軍も山田が蹴散らすよ新時代の幕開けだ ,"['山田最強だわござるとかこよりとかいらん', '一軍も山田が蹴散らすよ新時代の幕開けだ']"
2022-03-07 19:04:43,name_2_words_msg_jp,0,False,UCSG80R7uCk2nfuM0BrHx6pA,loiwru luire,バカ「シャドウバンされた！シャドウバンされた！バンされてるから同接に反映されない！」 ,['バカ「シャドウバンされた！シャドウバンされた！バンされてるから同接に反映されない！」']
2022-03-07 19:04:46,name_2_words_msg_jp,0,False,UCjL2up_DtLwl5oGrN5xxuyQ,Babu Zaman,マリンに誘われたらやらねーよfafafaってやらなさそう ,['マリンに誘われたらやらねーよfafafaってやらなさそう']
2022-03-07 19:04:49,name_2_words_msg_jp,0,False,UCK1W-_6VSYdqR7rZSLFlSuA,Quỳnh Lam Hoàng,その後、ドラゴンは3期生達一人一人に自分が被っている冠の色を答えるように命令する ,['その後、ドラゴンは3期生達一人一人に自分が被っている冠の色を答えるように命令する']
2022-03-07 19:04:49,name_2_words_msg_jp,0,False,UCp6OKGo7oXyQ8b1KFT2pJzQ,Sydnee Hanna,ぺこらとみこは非常によく似ているんだよ ,['ぺこらとみこは非常によく似ているんだよ']
2022-03-07 19:04:50,name_2_words_msg_jp,0,False,UCN_os6BIy8TjVBAGs_isXhA,Thái Vân Hình,山田がマイクラやってるとき吾輩黒より白が好きなんだよねって言ってて ,['山田がマイクラやってるとき吾輩黒より白が好きなんだよねって言ってて']
2022-03-07 19:04:51,id_in_block_list,0,False,UCpJHlncdXgelPKEoBbl4kww,Trúc Loan Hướng,何で許諾的に無理ってハッキリ言わんのかと思ったけどペルソナ3騒動見てホロメンが言わないのも納得したわ ,['何で許諾的に無理ってハッキリ言わんのかと思ったけどペルソナ3騒動見てホロメンが言わないのも納得したわ']
2022-03-07 19:04:55,name_2_words_msg_jp,0,False,UCLLUnyr5muaH1UOpDw0GU8w,Thảo Vy Ông,ホロアン「三連スタンプ打ってるのガイジだろ何が楽しいんだ」 ,['ホロアン「三連スタンプ打ってるのガイジだろ何が楽しいんだ」']
2022-03-07 19:04:56,similar_long_msg,0,False,UCdnM7RwMdRcJdxR2NY37Ynw,treda kelma,毎日毎日徹夜してフリチャを見るのは疲れたでしょう、気に入らない言葉一つも人に見れないとするのは大変苦労したね,['毎日毎日徹夜してフリチャを見るのは疲れたでしょう、気に入らない言葉一つも人に見れないとするのは大変苦労したね']
2022-03-07 19:04:56,name_2_words_msg_jp,0,False,UCFXVVXf5_rCbs3mp2C3wTkQ,Kasey Pruitt,170億騙し取ってビットコインに変えてたら200億円に値上がりｗ これってソニー生命に,"['170億騙し取ってビットコインに変えてたら200億円に値上がりｗ', 'これってソニー生命に']"
2022-03-07 19:04:57,name_2_words_msg_jp,0,False,UCmCBTjtOnxWhlblvjIzssvw,Ngọc Tuyết Cái,鏡よ鏡、このホロライブで一番”親方”にふさわしいのは誰？,['鏡よ鏡、このホロライブで一番”親方”にふさわしいのは誰？']
2022-03-07 19:04:58,name_2_words_msg_jp,0,False,UCeFTNrDMQ57-LFyyaSqOh-g,Thùy Dương Trịnh,国内で男性Vに力入れて勝ち目のない戦いをしてる間ににじEN男に英語圏制覇されてて草 ,['国内で男性Vに力入れて勝ち目のない戦いをしてる間ににじEN男に英語圏制覇されてて']
2022-03-07 19:05:00,name_2_words_msg_jp,0,False,UC1UQVU8BNSAekZydMvG7LXQ,Sorifa Saim,スバルくらい健常だとある日いきなり結婚しても驚きはしても納得するかな 俺もV引退するわ ,"['スバルくらい健常だとある日いきなり結婚しても驚きはしても納得するかな', '俺もV引退するわ']"
2022-03-07 19:05:00,name_2_words_msg_jp,0,False,UCR_nb45ANqrOvFoAonulnAg,Kenzie Gould,ホロメンが言ってる病欠が全部真実だと思ってるんだ？ ,['ホロメンが言ってる病欠が全部真実だと思ってるんだ？']
2022-03-07 19:05:05,name_2_words_msg_jp,0,False,UCCda4_trpgkx5vuJRBZfRjw,Nhã Lý Bế,ちーさん「YouTube Studioなら6000なのに3000って表示されてる」 ,"['ちーさん「YouTube', 'Studioなら6000なのに3000って表示されてる」']"
2022-03-07 19:05:08,id_in_block_list,0,False,UCp_MuivJ3w96DFuxmfIvcCw,Bobby Jacobse,どう考えてもこの一斉ARKは運営の指示なりあるでしょ ,['どう考えてもこの一斉ARKは運営の指示なりあるでしょ']
2022-03-07 19:05:10,name_2_words_msg_jp,0,False,UCUoGvzNnDKnOp6ctmLPSziA,really iutyt,3.3%がLGBTAだから、ホロメンにも1人はいる計算になるぞ ,['3.3%がLGBTAだから、ホロメンにも1人はいる計算になるぞ']
2022-03-07 19:05:11,name_2_words_msg_jp,0,False,UCmgO06qGx82TG8__711DiIw,Elvis Irwin,にじの麻雀大会見てるけど画面も見やすいし解説も上手いな ,['にじの麻雀大会見てるけど画面も見やすいし解説も上手いな']
2022-03-07 19:05:11,id_in_block_list,0,False,UCFXVVXf5_rCbs3mp2C3wTkQ,Kasey Pruitt,あくたんは被害者 ねねが元凶 誰がどう見てもこれだろ 議論する余地もなくないか？ ,"['あくたんは被害者', 'ねねが元凶', '誰がどう見てもこれだろ', '議論する余地もなくないか？']"
2022-03-07 19:05:13,name_2_words_msg_jp,0,False,UC01UV5ntIETm_QCFJyansbw,Việt Tuyết Thạch,スケジュールや配信予定地見てみて ,['スケジュールや配信予定地見てみて']
2022-03-07 19:05:14,name_2_words_msg_jp,0,False,UCVTxBGjOI_b3vy3UBBxDfwA,Ethan Jamesy,今日のVの串越え 社築 にじヌーン サメちゃん 以上です ,"['今日のVの串越え', '社築', 'にじヌーン', 'サメちゃん', '以上です']"
2022-03-07 19:05:14,name_2_words_msg_jp,0,False,UCGaovDEHiGlUGakwN5fRpvQ,Như Loan Đặng,にじで戻りが大きく遅くなるチャンネルが現れだしたのはぶいらび上1月3日から ,['にじで戻りが大きく遅くなるチャンネルが現れだしたのはぶいらび上1月3日から']
2022-03-07 19:05:15,name_2_words_msg_jp,0,False,UC7Mx5F5zWqX3kmNzWTd_6ug,Thục Dình Mai,また、食料には消費期限があり、時間が経つと腐敗して食べられなくなってしまう。,['また、食料には消費期限があり、時間が経つと腐敗して食べられなくなってしまう。']
2022-03-07 19:05:16,name_2_words_msg_jp,0,False,UCS7J57QAmmiZ26fXFF9XSCA,Mỹ Uyên Trình,ガチ恋多いなら男ヴァロガイガイ言われそうだけど ,['ガチ恋多いなら男ヴァロガイガイ言われそうだけど']
2022-03-07 19:05:17,name_2_words_msg_jp,0,False,UClssFfevbQiqljx2b33Cpaw,Ngọc Lâm Doãn,お前は独りなんかじゃない、俺たちが居る ,['お前は独りなんかじゃない、俺たちが居る']
2022-03-07 19:05:17,name_2_words_msg_jp,0,False,UCoGKAaKEaLEHY3pLq2vQzYA,matheyp pereraxs,樋口「ライブなくなったりし続けてるやん ,['樋口「ライブなくなったりし続けてるやん']
2022-03-07 19:05:18,name_2_words_msg_jp,0,False,UC3jANJqwrhsemFBfUVOjt2A,Harper Cooke,はあちゃま「予定はないけど、はあちゃまはしたいと思ってます！」 ,['はあちゃま「予定はないけど、はあちゃまはしたいと思ってます！」']
2022-03-07 19:05:19,name_2_words_msg_jp,0,False,UCr4C2FQmSE9A2fs_I1gGggw,Tâm Hạnh Thạch,遊戯王とかオワコンだと思ってたからバフになってるのが意外だわ ,['遊戯王とかオワコンだと思ってたからバフになってるのが意外だわ']
2022-03-07 19:05:20,id_in_block_list,0,False,UC1UQVU8BNSAekZydMvG7LXQ,Sorifa Saim,ホロメンもヘラるくらいならバンバンブロックしてええぞ ,['ホロメンもヘラるくらいならバンバンブロックしてええぞ']
2022-03-07 19:05:22,name_2_words_msg_jp,0,False,UC6WlwES0Y1FLz1WttICjlwA,Shamim Samnio,登録者７万人だったけど、こいつは絶対伸びると思った ,['登録者７万人だったけど、こいつは絶対伸びると思った']
2022-03-07 19:05:22,name_2_words_msg_jp,0,False,UCMlLGPPHqbc3we8FTC92zog,Thanh Mẫn Phó,さっきコンビニで携帯でしゃべりながら店内歩き回ってる女がいたんだけど ,['さっきコンビニで携帯でしゃべりながら店内歩き回ってる女がいたんだけど']
2022-03-07 19:05:23,id_in_block_list,0,False,UCmXxMZtIHPqhnU4oBmjnxGg,Sandra Jorfdan,ぶいすぽののあもぺクス大会でチームのロボ子親方のコーン配慮して ,['ぶいすぽののあもぺクス大会でチームのロボ子親方のコーン配慮して']
2022-03-07 19:05:23,name_2_words_msg_jp,0,False,UC5puxQUHi9X8XeETd471A4Q,Kirby Houle,俺の中でトワ様メンタル強そうなイメージあるからちょっとショック ,['俺の中でトワ様メンタル強そうなイメージあるからちょっとショック']
2022-03-07 19:05:24,name_2_words_msg_jp,0,False,UCPXwG9GqXU99cj2HIUgSBig,Trúc Lan Cam,色々配信環境いじくりすぎてマリカがまともに走れない状況なんだろう ,['色々配信環境いじくりすぎてマリカがまともに走れない状況なんだろう']
2022-03-07 19:05:27,id_in_block_list,0,False,UCzrtSO4m1E9KmGGpElcVaIQ,Jessica Piercegu,すこん部のみんなが大好きって思ってもらえるように わたしもいっぱい大好きな気持ち伝えるねっ,"['すこん部のみんなが大好きって思ってもらえるように', 'わたしもいっぱい大好きな気持ち伝えるねっ']"
2022-03-07 19:05:27,name_2_words_msg_jp,0,False,UCHAB3ZxvfgA3nGsxFxRQZwA,Ái Hồng Viên,今は良いけどこのまま数字低いままだったらオワコン感漂って人が離れかねんから早く対応してくれ ,['今は良いけどこのまま数字低いままだったらオワコン感漂って人が離れかねんから早く対応してくれ']
2022-03-07 19:05:28,name_2_words_msg_jp,0,False,UC48O9NbOBOAxBRN5sqaIptA,Vân Trang Đới,同接バグの影響がアクティブ数の減少につながってる ,['同接バグの影響がアクティブ数の減少につながってる']
2022-03-07 19:05:28,name_2_words_msg_jp,0,False,UCuG1swXhkoANRxCMeCdnHjQ,bella houa,みこちがフォトショですいちゃんがクリスタだったような ,['みこちがフォトショですいちゃんがクリスタだったような']
2022-03-07 19:05:36,name_2_words_msg_jp,0,False,UC-7HNldgWCvheznX6Yr2dLA,Nguyên Hồng Bạch,まぁ山田のガチャとござるのJK以外は普通にゲームしてるだけだからな ,['まぁ山田のガチャとござるのJK以外は普通にゲームしてるだけだからな']
2022-03-07 19:05:37,name_2_words_msg_jp,0,False,UCjgJhJ_I1GsarxDEYYWfIgw,Daniel wag,はよく覚えてるよこのスレのスレタイ改,['はよく覚えてるよこのスレのスレタイ改']
2022-03-07 19:05:38,name_2_words_msg_jp,0,False,UCdeqegExxyc4D5O0sPrKw-A,Simo Muhammad,スパチャってかわいいとか名前呼ばれるために投げるんじゃなくて配信ありがとう新衣装ありがとうみたいに感謝の気持ちで投げることが多いわ ,['スパチャってとか名前呼ばれるために投げるんじゃなくて配信ありがとう新衣装ありがとうみたいに感謝の気持ちで投げることが多いわ']
2022-03-07 19:05:39,name_2_words_msg_jp,0,False,UCgW78qNX3R3feQOpxJYAk1A,Uyển Nhã Phạm,クロエは最初の全読み宣言が最大の失敗だったな ,['クロエは最初の全読み宣言が最大の失敗だったな']
2022-03-07 19:05:40,name_2_words_msg_jp,0,False,UCf4VzrTASYPgg20Vv2xCoww,Ambrose Barrett,ルーナちゃんは可愛いイラストを良いねしてるだけだよ ,['ルーナちゃんは可愛いイラストを良いねしてるだけだよ']
2022-03-07 19:05:42,name_2_words_msg_jp,0,False,UCrV-Afw6Mhlt2_BH49KK-fQ,Thiên Nga Điền,ASMRはASMRだけ見る謎の集団がいるからホロを普段見てるリスナーのバグは関係ないぞ ,['ASMRはASMRだけ見る謎の集団がいるからホロを普段見てるリスナーのバグは関係ないぞ']
2022-03-07 19:05:43,name_2_words_msg_jp,0,False,UCvUpC9T7WsRBkSEK-r3VwLA,See Fuston,そもそもまだ訴状も何も届いてない ,['そもそもまだ訴状も何も届いてない']
2022-03-07 19:05:44,name_2_words_msg_jp,0,False,UC-7DRcPVOnpp6I7byh5GvWg,Xuân Hoa Kiều,これでお別れだ。じゃあな、YouTube。元気で暮らせよ。スーザンによろしくな。 ,['これでお別れだ。じゃあな、YouTube。元気で暮らせよ。スーザンによろしくな。']
2022-03-07 19:05:46,name_2_words_msg_jp,0,False,UCFMVHqPFZV8N0byHhSiyaWg,A_ Star,その力は開放するとレッドランプなんよ,['その力は開放するとレッドランプなんよ']
2022-03-07 19:05:56,id_in_block_list,0,False,UC9PznwtNWFl7kvpvRjQg4og,Thanh Hạnh Kiều,きんにくん吉本退所でググって気付いたけど ,['きんにくん吉本退所でググって気付いたけど']
2022-03-07 19:05:56,name_2_words_msg_jp,0,False,UCevKKSIrqt3WFPJwC3FYzLQ,Nhã Hồng Bạch,ものが通用する次元ではない俺も俺の中,['ものが通用する次元ではない俺も俺の中']
2022-03-07 19:05:58,name_2_words_msg_jp,0,False,UCRiZ0pTgiQmzjj4byZNoDuQ,antea elukabr,ホロライブってなんでこんなにコメントの流れ早いんだ？ ,['ホロライブってなんでこんなにコメントの流れ早いんだ？']
2022-03-07 19:05:59,name_2_words_msg_jp,0,False,UCKbjlggHzU2JMY2XFFYnqgg,Xuân Hạnh Hoàng,うまいやつしか楽しめないし配信でも質を出せない ,['うまいやつしか楽しめないし配信でも質を出せない']
2022-03-07 19:05:59,name_2_words_msg_jp,0,False,UCX_Xyf-wWJA51bFf-N08urA,Thùy Dung Trình,同接って指標としてニッチすぎるのここの連中まじで分かってないよな ,['同接って指標としてニッチすぎるのここの連中まじで分かってないよな']
2022-03-07 19:06:02,name_2_words_msg_jp,0,False,UCZHAJzmtY3xvkJlSNOS7cvQ,Michale Abramson,配信者ってつべやツイッターのコメだけじゃ満足できないんかな？ ,['配信者ってつべやツイッターのコメだけじゃ満足できないんかな？']
2022-03-07 19:06:04,name_2_words_msg_jp,0,False,UC034_FjLvnbN3mukrtXAdWQ,Thái Hà Trà,頭脳ってなんだろう、って思ったらやっぱり配信を見に来て下さったファンの背景、 ,['頭脳ってなんだろう、って思ったらやっぱり配信を見に来て下さったファンの背景、']
2022-03-07 19:06:05,name_2_words_msg_jp,0,False,UCXZKkzexvSSrF7LjaWhmdCw,Thụy Linh Trà,このスレ観てても思うけど なんでVオタとかアニオタってネトウヨ多いの ,"['このスレ観てても思うけど', 'なんでVオタとかアニオタってネトウヨ多いの']"
2022-03-07 19:06:07,name_2_words_msg_jp,0,False,UCyZS9GikTjkw59MFt-XBAsQ,Vân Trang Tống,こんなに可愛いフブキさんに会えるならゲームのお金めっちゃあったけど安いもんよ！,['こんなに可愛いフブキさんに会えるならゲームのお金めっちゃあったけど安いもんよ！']
2022-03-07 19:06:07,name_2_words_msg_jp,0,False,UCXZgXbtBhO8eidO0BTr7Hug,Serdia K,クロエは無理しないる！を目指したいんだろ ,['クロエは無理しないる！を目指したいんだろ']
2022-03-07 19:06:07,name_2_words_msg_jp,0,False,UCWKLJWwvYnDw40m3J3xfAVg,Thư Lâm Nông,リスちゃんって色んな声だせてこんなに上手かったのか…ガチで既にクロエの上位互換過ぎて売り出さない運営無能すぎん？ ,['リスちゃんって色んな声だせてこんなに上手かったのか…ガチで既にクロエの上位互換過ぎて売り出さない運営無能すぎん？']
2022-03-07 19:06:08,name_2_words_msg_jp,0,False,UCIyBuMmFi-27QrvsVlFQRlw,Serina Johnsonfjv,アイテムももうないだろうし連れて行った恐竜とテイムしたの逝って ,['アイテムももうないだろうし連れて行った恐竜とテイムしたの逝って']
2022-03-07 19:06:10,name_2_words_msg_jp,0,False,UCYG_Dt5DthzRjjonNUKydvw,Thủy Nguyệt Tòng,スーパーチャットはにじさんじに還元されてライブに出れて云々を甘えてた ,['スーパーチャットはにじさんじに還元されてライブに出れて云々を甘えてた']
2022-03-07 19:06:13,name_2_words_msg_jp,0,False,UCFW2WtgmZUbT-HeLue1Cf0g,Thục Oanh Chung,しかし、VTuberなどネット民受けするコラボが多いため、オタクからの評価は真逆。,['しかし、VTuberなどネット民受けするコラボが多いため、オタクからの評価は真逆。']
2022-03-07 19:06:14,name_2_words_msg_jp,0,False,UCaTRikE9Nx1o8KDAtCU3DkQ,Trúc Vy Cái,再投稿しておきますね〜 2020年はDeFi、2021年はNFT、2022年は間違いなくDAO。 ,"['再投稿しておきますね〜', '2020年はDeFi、2021年はNFT、2022年は間違いなくDAO。']"
2022-03-07 19:06:14,id_in_block_list,0,False,UCA1fksxxh16k4ZehusxCn6w,Weldon Alva,アフィチルくん集中砲火されたら効きすぎちゃったね ,['アフィチルくん集中砲火されたら効きすぎちゃったね']
2022-03-07 19:06:15,name_2_words_msg_jp,0,False,UCC19eNBRxFJaCsnTE_VC5Mg,Vinisha Vinny,いやーこよりね、ホロライブに入る前からずっと先輩たちのARK見てたんだよね ,['いやーこよりね、ホロライブに入る前からずっと先輩たちのARK見てたんだよね']
2022-03-07 19:06:19,name_2_words_msg_jp,0,False,UC2RRa99-ZkWyZgmCceITW5A,Edi Dervishi,六期生は全滅、頼みのぺこらの新衣装はにじマリカに敗北する ,['六期生は全滅、頼みのぺこらの新衣装はにじマリカに敗北する']
2022-03-07 19:06:21,name_2_words_msg_jp,0,False,UC77o_JKzhOjSb0_4rfNHb2Q,Nguyệt Hà Trịnh,みこのサムネで知って初めてメルさんのASMR聴く気になったが良かったぜ ,['みこのサムネで知って初めてメルさんのASMR聴く気になったが良かったぜ']
2022-03-07 19:06:21,name_2_words_msg_jp,0,False,UCuB_DSEgw83qUX-3B2jB8bA,John Howser,叩く流れ作るための誘導コピペ連投なんてマリンとかもされてたのに ,['叩く流れ作るための誘導コピペ連投なんてマリンとかもされてたのに']
2022-03-07 19:06:21,id_in_block_list,0,False,UCpJ9ZJD5Qo8IIKlfXZ5sPwg,Phương Giang Đàm,多分中の人の仕事の都合もあるんじゃね ,['多分中の人の仕事の都合もあるんじゃね']
2022-03-07 19:06:23,name_2_words_msg_jp,0,False,UCTDkhCwn3Z_PSau3i6_tc5w,Vân Phi Thái,再生数が予想で数千～数万の響ラジオで放送作家分赤字だけどこよりのトーク力を鍛え上げる出費はここまでかけるべきだよ ,['再生数が予想で数千～数万の響ラジオで放送作家分赤字だけどこよりのトーク力を鍛え上げる出費はここまでかけるべきだよ']
2022-03-07 19:06:26,name_2_words_msg_jp,0,False,UCj8QRoBx-6lxasPf7G3s9dQ,doanna pahuea,タグ寄生してるノックチャンネルっていつも同接こんなもんだった気がするけどやっぱバグとか,['タグ寄生してるノックチャンネルっていつも同接こんなもんだった気がするけどやっぱバグとか']
2022-03-07 19:06:30,name_2_words_msg_jp,0,False,UCTBHnru_MGwleS_GA8UNYtw,Trang Nhã Sầm,赤スパ限定＋スパチャ読みで最低の数字だしたなクロエｗ ,['赤スパ限定＋スパチャ読みで最低の数字だしたなクロエｗ']
2022-03-07 19:06:32,name_2_words_msg_jp,0,False,UCUvjZBS9I2jH07taOOemrNw,Thùy Dung Giáp,ホロライブはそういう今の時代に大切な精神を俺たちにアイドルを通して教えてくれると、俺はそう信じてる ,['ホロライブはそういう今の時代に大切な精神を俺たちにアイドルを通して教えてくれると、俺はそう信じてる']
2022-03-07 19:06:33,name_2_words_msg_jp,0,False,UCsNclH1tIlrazSHB1yx5haQ,Hannan Pajd,誕生日に贈られてる熱心な手書き手紙付きファンアート無視してるよ ,['誕生日に贈られてる熱心な手書き手紙付きファンアート無視してるよ']
2022-03-07 19:06:33,name_2_words_msg_jp,0,False,UCqUL3zquwh7dx19R8lduoBw,exi kkol,年収億なのに中身の年収720万でイキってどうすんねん ,['年収億なのに中身の年収720万でイキってどうすんねん']
2022-03-07 19:06:37,name_2_words_msg_jp,0,False,UCAxQxoQGNGxx2jGtYXG3QLw,Xuân Thu Đặng,ココはいったから自分もってやつか？ ,['ココはいったから自分もってやつか？']
2022-03-07 19:06:37,name_2_words_msg_jp,0,False,UC0TtapxNNqGpqkf2zpBuKzg,Thanh Lâm Trình,妊娠発覚。DQN「産もうぜ(笑)」 ,['妊娠発覚。DQN「産もうぜ(笑)」']
2022-03-07 19:06:40,id_in_block_list,0,False,UCfVL8190DcF8tLatglPorzA,Thi Ngôn Phạm,面白いんだよなぁ。お母さんにゲームやらせてるみたいで ,['面白いんだよなぁ。お母さんにゲームやらせてるみたいで']
2022-03-07 19:06:40,name_2_words_msg_jp,0,False,UCVy5sjSjPE10S-HR1Exj5kA,ralph jonese,これだけ金盾保持してる企業日本でもそういないからな ,['これだけ金盾保持してる企業日本でもそういないからな']
2022-03-07 19:06:43,name_2_words_msg_jp,0,False,UCDeUOpMBz37UV5xZpctN6XQ,Sơn Tuyền Triệu,ぶっちゃけトワの方が狙われると思うわ ,['ぶっちゃけトワの方が狙われると思うわ']
2022-03-07 19:06:43,name_2_words_msg_jp,0,False,UCF4eOfJa3YhBvSeM7oQPZtQ,Phương Trà Đan,なんか同じので飽きちゃったよ６期 ,['なんか同じので飽きちゃったよ６期']
2022-03-07 19:06:47,name_2_words_msg_jp,0,False,UC8g9xngrzr9A5rBkLgePtjw,Ngọc Hoan Sầm,何万か再生されちゃってるけど まじでバグなくなったか？ ,"['何万か再生されちゃってるけど', 'まじでバグなくなったか？']"
2022-03-07 19:06:47,name_2_words_msg_jp,0,False,UCgz9ts6REahqiUn-M8L26Iw,teddy polston,ホロ2年見続けた俺が断言するけど6期の精神的支えになるよ ,['ホロ2年見続けた俺が断言するけど6期の精神的支えになるよ']
2022-03-07 19:06:47,name_2_words_msg_jp,0,False,UCAbLdWHKTOtTtx2iKALf9_g,Gazmir Zane,スパチャの使い道なんて運営企業の活動資金になるの決まってるのにこんな認識だったのか…,['スパチャの使い道なんて運営企業の活動資金になるの決まってるのにこんな認識だったのか…']
2022-03-07 19:06:48,name_2_words_msg_jp,0,False,UC5dx9SAYj3kzVL9YpCxbQMg,denal freda,けどあくたんまたこれで放送しなくなるだろうな ,['けどあくたんまたこれで放送しなくなるだろうな']
2022-03-07 19:06:48,id_in_block_list,0,False,UCnVGmmRV6lwab69wKWq8kNQ,Tú Sương Hán,レンジャーになりきって戦隊モノのメタ発言したら笑いに持っていけたのに ,['レンジャーになりきって戦隊モノのメタ発言したら笑いに持っていけたのに']
2022-03-07 19:06:48,name_2_words_msg_jp,0,False,UCXHGCN9xhMXLyvIZ487ps_Q,Jsiiso Ntidti,この時3期生達は自分以外の答えを聞くことはできない ,['この時3期生達は自分以外の答えを聞くことはできない']
2022-03-07 19:06:50,name_2_words_msg_jp,0,False,UCUBAQcpJtQkdXBYUqIK-L8g,Wilbert Lash,これまで何度も他のホロメンの企画と案件を奪ったけど、関連作品を知ることもしないし軽視するだけだから公平競争になった今オメェは何も手に入れねぇよ,['これまで何度も他のホロメンの企画と案件を奪ったけど、関連作品を知ることもしないし軽視するだけだから公平競争になった今オメェは何も手に入れねぇよ']
2022-03-07 19:06:53,name_2_words_msg_jp,0,False,UCAl0NR2Q-sPZsewE93INexA,Ngọc Ánh Quàng,また、メモリアルイヤーの一環として2022年1月22日には、3年ぶりとなるソロライブ『ときのそら ,['また、メモリアルイヤーの一環として2022年1月22日には、3年ぶりとなるソロライブ『ときのそら']
2022-03-07 19:06:54,id_in_block_list,0,False,UCORXZMt2RY9UDFiC1_wnubg,Coleman Retana,ゲームもあくたん並にうまくてプロゲーマー狙える ,['ゲームもあくたん並にうまくてプロゲーマー狙える']
